{
  "format_version": 1,
  "world_id": "four-way",
  "description": "Synthetic physical-device mapping: one shared vehicle signal device per approach. Not a surveyed real-world inventory.",
  "devices": [
    {
      "id": "north",
      "label": "North approach",
      "x": 198.4,
      "y": 207.2,
      "lane_ids": [
        "north_in_0"
      ],
      "signal_id": "center",
      "link_indices": [
        0,
        1,
        2
      ]
    },
    {
      "id": "east",
      "label": "East approach",
      "x": 207.2,
      "y": 201.6,
      "lane_ids": [
        "east_in_0"
      ],
      "signal_id": "center",
      "link_indices": [
        3,
        4,
        5
      ]
    },
    {
      "id": "south",
      "label": "South approach",
      "x": 201.6,
      "y": 192.8,
      "lane_ids": [
        "south_in_0"
      ],
      "signal_id": "center",
      "link_indices": [
        6,
        7,
        8
      ]
    },
    {
      "id": "west",
      "label": "West approach",
      "x": 192.8,
      "y": 198.4,
      "lane_ids": [
        "west_in_0"
      ],
      "signal_id": "center",
      "link_indices": [
        9,
        10,
        11
      ]
    }
  ]
}
