{
  "format_version": 1,
  "world_id": "podu-ros-neural",
  "description": "Estimated approach devices from SUMO signal links and incoming lane geometry; verify physical inventory and pole locations before field use.",
  "devices": [
    {
      "id": "light-01",
      "label": "Podu Roș approach 01",
      "x": 359.42,
      "y": 485.06,
      "lane_ids": [
        "1072468318_1",
        "1072468318_2",
        "1072468318_3"
      ],
      "signal_id": "1846743533",
      "link_indices": [
        2,
        3,
        4
      ]
    },
    {
      "id": "light-02",
      "label": "Bulevardul Regele Mihai I al României approach 02",
      "x": 344.68,
      "y": 488.51,
      "lane_ids": [
        "165518602#1_1",
        "165518602#1_2"
      ],
      "signal_id": "1846743533",
      "link_indices": [
        0,
        1
      ]
    },
    {
      "id": "light-03",
      "label": "Bulevardul Țuțora approach 03",
      "x": 404.46,
      "y": 455.22,
      "lane_ids": [
        "305272857#0_1",
        "305272857#0_2"
      ],
      "signal_id": "244529560",
      "link_indices": [
        0,
        1,
        2
      ]
    },
    {
      "id": "light-04",
      "label": "Piața Podu Roș approach 04",
      "x": 396.15,
      "y": 448.63,
      "lane_ids": [
        "324784649#1_1",
        "324784649#1_2",
        "324784649#1_3"
      ],
      "signal_id": "244529560",
      "link_indices": [
        3,
        4,
        5,
        6
      ]
    },
    {
      "id": "light-05",
      "label": "Bulevardul Socola approach 05",
      "x": 395.48,
      "y": 398.69,
      "lane_ids": [
        "22776494_1",
        "22776494_2"
      ],
      "signal_id": "244530001",
      "link_indices": [
        0,
        1
      ]
    },
    {
      "id": "light-06",
      "label": "Piața Podu Roș approach 06",
      "x": 383.34,
      "y": 403.72,
      "lane_ids": [
        "325212457#0_1",
        "325212457#0_2",
        "325212457#0_3"
      ],
      "signal_id": "244530001",
      "link_indices": [
        2,
        3,
        4
      ]
    },
    {
      "id": "light-07",
      "label": "Strada Palat approach 07",
      "x": 398.51,
      "y": 549.51,
      "lane_ids": [
        "277230359#1_1",
        "277230359#1_2",
        "277230359#1_3",
        "277230359#1_4"
      ],
      "signal_id": "249821238",
      "link_indices": [
        0,
        1,
        2,
        3
      ]
    },
    {
      "id": "light-08",
      "label": "Bulevardul Regele Ferdinand I al României approach 08",
      "x": 400.91,
      "y": 537.89,
      "lane_ids": [
        "682623766#0_1",
        "682623766#0_2",
        "682623766#0_3"
      ],
      "signal_id": "249821238",
      "link_indices": [
        4,
        5,
        6,
        7,
        8
      ]
    },
    {
      "id": "light-09",
      "label": "Bulevardul Regele Mihai I al României approach 09",
      "x": 65.47,
      "y": 672.61,
      "lane_ids": [
        "165518602#0_1",
        "165518602#0_2"
      ],
      "signal_id": "275354485",
      "link_indices": [
        4,
        5,
        6,
        7
      ]
    },
    {
      "id": "light-10",
      "label": "Bulevardul Dimitrie Cantemir approach 10",
      "x": 64.64,
      "y": 664.5,
      "lane_ids": [
        "303755190#2_1",
        "303755190#2_2",
        "303755190#2_3"
      ],
      "signal_id": "275354485",
      "link_indices": [
        0,
        1,
        2,
        3
      ]
    },
    {
      "id": "light-11",
      "label": "Strada Nicolina approach 11",
      "x": 337.8,
      "y": 393.58,
      "lane_ids": [
        "1134276130#0_1",
        "1134276130#0_2"
      ],
      "signal_id": "3098726457",
      "link_indices": [
        0,
        1
      ]
    },
    {
      "id": "light-12",
      "label": "Piața Podu Roș approach 12",
      "x": 340.53,
      "y": 408.22,
      "lane_ids": [
        "305271348_1",
        "305271348_2",
        "305271348_3"
      ],
      "signal_id": "3098726457",
      "link_indices": [
        2,
        3,
        4
      ]
    },
    {
      "id": "light-13",
      "label": "Podu Roș approach 13",
      "x": 351.71,
      "y": 473.31,
      "lane_ids": [
        "1076971041_1",
        "1076971041_2",
        "1076971041_3"
      ],
      "signal_id": "31202499",
      "link_indices": [
        0,
        1,
        2
      ]
    },
    {
      "id": "light-14",
      "label": "Piața Podu Roș approach 14",
      "x": 361.96,
      "y": 467.06,
      "lane_ids": [
        "324962581#0_1",
        "324962581#0_2",
        "324962581#0_3"
      ],
      "signal_id": "31202499",
      "link_indices": [
        3,
        4,
        5
      ]
    },
    {
      "id": "light-15",
      "label": "Podu Roș approach 15",
      "x": 414.42,
      "y": 521.23,
      "lane_ids": [
        "29377424_1",
        "29377424_2",
        "29377424_3"
      ],
      "signal_id": "880269336",
      "link_indices": [
        4,
        5,
        6
      ]
    },
    {
      "id": "light-16",
      "label": "Bulevardul Profesor Dimitrie Mangeron approach 16",
      "x": 425.17,
      "y": 523.16,
      "lane_ids": [
        "305256944#0_1",
        "305256944#0_2",
        "305256944#0_3"
      ],
      "signal_id": "880269336",
      "link_indices": [
        0,
        1,
        2,
        3
      ]
    },
    {
      "id": "light-17",
      "label": "Strada Palat approach 17",
      "x": 401.71,
      "y": 644.29,
      "lane_ids": [
        "-1068015153#1_1"
      ],
      "signal_id": "cluster_12043430975_2178366591_2613532418_31202497_#2more",
      "link_indices": [
        10
      ]
    },
    {
      "id": "light-18",
      "label": "Strada Sfântul Lazăr approach 18",
      "x": 452.41,
      "y": 642.61,
      "lane_ids": [
        "-25368524#1_1",
        "-25368524#1_2"
      ],
      "signal_id": "cluster_12043430975_2178366591_2613532418_31202497_#2more",
      "link_indices": [
        0,
        1,
        2,
        3
      ]
    },
    {
      "id": "light-19",
      "label": "Strada Sfântul Lazăr approach 19",
      "x": 451.67,
      "y": 623.66,
      "lane_ids": [
        "22895248_1",
        "22895248_2"
      ],
      "signal_id": "cluster_12043430975_2178366591_2613532418_31202497_#2more",
      "link_indices": [
        4,
        5,
        6,
        7
      ]
    },
    {
      "id": "light-20",
      "label": "Strada Palat approach 20",
      "x": 429.22,
      "y": 596.48,
      "lane_ids": [
        "663624561_1"
      ],
      "signal_id": "cluster_12043430975_2178366591_2613532418_31202497_#2more",
      "link_indices": [
        8,
        9
      ]
    },
    {
      "id": "light-21",
      "label": "Strada Nicolina approach 21",
      "x": 175.55,
      "y": 110.17,
      "lane_ids": [
        "1068019512#0_1",
        "1068019512#0_2"
      ],
      "signal_id": "cluster_335640349_9804878311_9804878312_9804878316",
      "link_indices": [
        9,
        10,
        11,
        12,
        13
      ]
    },
    {
      "id": "light-22",
      "label": "Aleea Rozelor approach 22",
      "x": 186.61,
      "y": 114.53,
      "lane_ids": [
        "1225444914#0_1"
      ],
      "signal_id": "cluster_335640349_9804878311_9804878312_9804878316",
      "link_indices": [
        5,
        6,
        7,
        8
      ]
    },
    {
      "id": "light-23",
      "label": "Strada Nicolina approach 23",
      "x": 171.16,
      "y": 129.51,
      "lane_ids": [
        "305271347_1",
        "305271347_2"
      ],
      "signal_id": "cluster_335640349_9804878311_9804878312_9804878316",
      "link_indices": [
        0,
        1,
        2,
        3,
        4
      ]
    },
    {
      "id": "light-24",
      "label": "Aleea Rozelor approach 24",
      "x": 160.16,
      "y": 124.88,
      "lane_ids": [
        "58636262#2_1"
      ],
      "signal_id": "cluster_335640349_9804878311_9804878312_9804878316",
      "link_indices": [
        14,
        15,
        16,
        17
      ]
    }
  ]
}
